{
  "$schema": "https://json-schema.org/draft/2020-12/schema",
  "$id": "protected-concern-disposition-record.schema.json",
  "title": "Protected Concern Disposition Record",
  "description": "Reference-only public disposition for a protected concern. Not an intake form. Never stores reporter identity, source identity, allegation text, protected evidence, investigation detail, retaliation allegations, or private contact information. Reuses the Protected Concern Boundary. ACTIVE concern cannot be represented as resolved. HOLD cannot become authorization. STALE requires revalidation. Closure requires bounded evidence reference. Public record never implies the underlying allegation is true or false.",
  "type": "object",
  "additionalProperties": false,
  "properties": {
    "schema_version": {
      "type": "string",
      "const": "1.0.0",
      "minLength": 1
    },
    "concern_disposition_id": {
      "type": "string",
      "minLength": 1
    },
    "opaque_concern_ref": {
      "type": "string",
      "minLength": 1
    },
    "subject_id": {
      "type": "string",
      "minLength": 1
    },
    "configuration_digest": {
      "type": "string",
      "pattern": "^sha256:[a-f0-9]{64}$"
    },
    "materiality": {
      "type": "string",
      "minLength": 1
    },
    "assurance_effect": {
      "type": "string",
      "enum": ["QUESTIONED", "STALE", "HOLD"],
      "minLength": 1
    },
    "opened_at": {
      "type": "string",
      "pattern": "^\\d{4}-\\d{2}-\\d{2}T\\d{2}:\\d{2}:\\d{2}Z$"
    },
    "status": {
      "type": "string",
      "enum": ["ACTIVE", "CLOSED"],
      "minLength": 1
    },
    "revalidation_required": {
      "type": "boolean"
    },
    "closure_evidence_refs": {
      "type": "array",
      "items": {
        "type": "string",
        "minLength": 1
      }
    },
    "limitations": {
      "type": "array",
      "minItems": 1,
      "items": {
        "type": "string",
        "minLength": 1
      }
    },
    "reference_only": {
      "type": "boolean",
      "const": true
    },
    "human_review_required": {
      "type": "boolean",
      "const": true
    },
    "authority_effect": {
      "type": "string",
      "const": "NONE"
    }
  },
  "required": [
    "schema_version",
    "concern_disposition_id",
    "opaque_concern_ref",
    "subject_id",
    "materiality",
    "assurance_effect",
    "opened_at",
    "status",
    "revalidation_required",
    "limitations",
    "reference_only",
    "human_review_required",
    "authority_effect"
  ]
}
