{
  "schema_version": "1.0.0",
  "concern_disposition_id": "concern-disp-synthetic-001",
  "opaque_concern_ref": "opaque-concern-alpha",
  "subject_id": "synthetic-subject-alpha",
  "configuration_digest": "sha256:abababababababababababababababababababababababababababababababab",
  "materiality": "material",
  "assurance_effect": "QUESTIONED",
  "opened_at": "2026-10-12T00:00:00Z",
  "status": "ACTIVE",
  "revalidation_required": true,
  "limitations": ["public record does not imply allegation true or false", "reuses Protected Concern Boundary"],
  "reference_only": true,
  "human_review_required": true,
  "authority_effect": "NONE"
}
